name,address,price
Google Local Business Listing,Google Local Business Listing,Ask Price
Google Local Business Listing,Google Local Business Listing,"₹3,000/ "
Local Business Listings,Local Business Listings,"₹1,999/ "
Google Place Map Local Business Listings,Google Place Map Local Business Listings,"₹1,999/ "
Local Business Listing Service,Local Business Listing Service,"₹5,000/ "
Google My Business Listing Service,Google My Business Listing Service,"₹10,000/ "
Local Business Listing Service,Local Business Listing Service,"₹4,998/ "
Local Business Listing Service,Local Business Listing Service,"₹3,000/ "
Google Business Listing Service,Google Business Listing Service,"₹11,000/ "
,,
,,
,,
Google Business Local Listing Service,Google Business Local Listing Service,"₹12,000/ "
Google My Business Local Listing Service,Google My Business Local Listing Service,"₹5,000/ "
Local Business Listing Service,Local Business Listing Service,"₹10,000/ "
"SEO Google My Business Listing Service, Business Industry Type: It Industry, 1 Month","SEO Google My Business Listing Service, Business Industry Type: It Industry, 1 Month","₹5,000/ "
"Professional Google Business Listing Service in Uttarkashi, Uttarakhand","Professional Google Business Listing Service in Uttarkashi, Uttarakhand","₹2,000/ "
